==START TEST==
CPU:
   0x00000000 0x00: eax=0x00000004 ebx=0x68747541 ecx=0x444d4163 edx=0x69746e65
   0x00000001 0x00: eax=0x00000633 ebx=0x00000800 ecx=0x80800001 edx=0x0781abfd
   0x00000002 0x00: eax=0x00000001 ebx=0x00000000 ecx=0x00000000 edx=0x002c307d
   0x00000003 0x00: eax=0x00000000 ebx=0x00000000 ecx=0x00000000 edx=0x00000000
   0x00000004 0x00: eax=0x00000121 ebx=0x01c0003f ecx=0x0000003f edx=0x00000001
   0x00000004 0x01: eax=0x00000122 ebx=0x01c0003f ecx=0x0000003f edx=0x00000001
   0x00000004 0x02: eax=0x00000143 ebx=0x03c0003f ecx=0x00000fff edx=0x00000001
   0x00000004 0x03: eax=0x00000000 ebx=0x00000000 ecx=0x00000000 edx=0x00000000
   0x80000000 0x00: eax=0x00000000 ebx=0x00000000 ecx=0x00000000 edx=0x00000000
   0xc0000000 0x00: eax=0x00000000 ebx=0x00000000 ecx=0x00000000 edx=0x00000000
   0x40000000 0x00: eax=0x40000001 ebx=0x4b4d564b ecx=0x564b4d56 edx=0x0000004d
   0x40000001 0x00: eax=0x010000f8 ebx=0x00000000 ecx=0x00000000 edx=0x00000000
==END TEST==
