[1;256r[256;256H[6n
Google, Inc.
Serial Graphics Adapter 07/26/11
SGABIOS $Id: sgabios.S 8 2010-04-22 00:03:40Z nlaredo $ (mockbuild@hs20-bc2-3.build.redhat.com) Tue Jul 26 15:05:08 UTC 2011
4 0
[2J[m[mSeaBIOS (version seabios-0.6.1.2-28.el6)


gPXE (http://etherboot.org) - 00:03.0 CA00 PCI2.10 PnP BBS PMM07E0@10 CA00
Press Ctrl-B to configure gPXE (PCI 00:03.0)...                                                                               

==START TEST==
CPU:
   0x00000000 0x00: eax=0x00000005 ebx=0x756e6547 ecx=0x6c65746e edx=0x49656e69
   0x00000001 0x00: eax=0x00000f61 ebx=0x00000800 ecx=0x80002001 edx=0x078bfbfd
   0x00000002 0x00: eax=0x00000001 ebx=0x00000000 ecx=0x00000000 edx=0x002c307d
   0x00000003 0x00: eax=0x00000000 ebx=0x00000000 ecx=0x00000000 edx=0x00000000
   0x00000004 0x00: eax=0x00000121 ebx=0x01c0003f ecx=0x0000003f edx=0x00000001
   0x00000004 0x01: eax=0x00000122 ebx=0x01c0003f ecx=0x0000003f edx=0x00000001
   0x00000004 0x02: eax=0x00000143 ebx=0x03c0003f ecx=0x00000fff edx=0x00000001
   0x00000004 0x03: eax=0x00000000 ebx=0x00000000 ecx=0x00000000 edx=0x00000000
   0x00000005 0x00: eax=0x00000000 ebx=0x00000000 ecx=0x00000003 edx=0x00000000
   0x80000000 0x00: eax=0x80000008 ebx=0x756e6547 ecx=0x6c65746e edx=0x49656e69
   0x80000001 0x00: eax=0x00000f61 ebx=0x00000000 ecx=0x00000000 edx=0x2191abfd
   0x80000002 0x00: eax=0x6d6d6f43 ebx=0x4b206e6f ecx=0x70204d56 edx=0x65636f72
   0x80000003 0x00: eax=0x726f7373 ebx=0x00000000 ecx=0x00000000 edx=0x00000000
   0x80000004 0x00: eax=0x00000000 ebx=0x00000000 ecx=0x00000000 edx=0x00000000
   0x80000005 0x00: eax=0x01ff01ff ebx=0x01ff01ff ecx=0x40020140 edx=0x40020140
   0x80000006 0x00: eax=0x00000000 ebx=0x42004200 ecx=0x02008140 edx=0x00000000
   0x80000007 0x00: eax=0x00000000 ebx=0x00000000 ecx=0x00000000 edx=0x00000000
   0x80000008 0x00: eax=0x00003027 ebx=0x00000000 ecx=0x00000000 edx=0x00000000
   0xc0000000 0x00: eax=0x00000000 ebx=0x00000000 ecx=0x00000003 edx=0x00000000
   0x40000000 0x00: eax=0x00000000 ebx=0x4b4d564b ecx=0x564b4d56 edx=0x0000004d
   0x40000001 0x00: eax=0x0100006b ebx=0x00000000 ecx=0x00000000 edx=0x00000000
==END TEST==
