==START TEST==
CPU:
   0x00000000 0x00: eax=0x0000000d ebx=0x756e6547 ecx=0x6c65746e edx=0x49656e69
   0x00000001 0x00: eax=0x000306d2 ebx=0x00000800 ecx=0xf7fa3203 edx=0x078bfbff
   0x00000002 0x00: eax=0x00000001 ebx=0x00000000 ecx=0x00000000 edx=0x002c307d
   0x00000003 0x00: eax=0x00000000 ebx=0x00000000 ecx=0x00000000 edx=0x00000000
   0x00000004 0x00: eax=0x00000121 ebx=0x01c0003f ecx=0x0000003f edx=0x00000001
   0x00000004 0x01: eax=0x00000122 ebx=0x01c0003f ecx=0x0000003f edx=0x00000001
   0x00000004 0x02: eax=0x00000143 ebx=0x03c0003f ecx=0x00000fff edx=0x00000001
   0x00000004 0x03: eax=0x00000000 ebx=0x00000000 ecx=0x00000000 edx=0x00000000
   0x00000005 0x00: eax=0x00000000 ebx=0x00000000 ecx=0x00000003 edx=0x00000000
   0x00000006 0x00: eax=0x00000000 ebx=0x00000000 ecx=0x00000000 edx=0x00000000
   0x00000007 0x00: eax=0x00000000 ebx=0x001c07a9 ecx=0x00000000 edx=0x00000000
   0x00000009 0x00: eax=0x00000000 ebx=0x00000000 ecx=0x00000000 edx=0x00000000
   0x0000000a 0x00: eax=0x00000000 ebx=0x00000000 ecx=0x00000000 edx=0x00000000
   0x0000000b 0x00: eax=0x00000000 ebx=0x00000000 ecx=0x00000000 edx=0x00000000
   0x0000000c 0x00: eax=0x00000000 ebx=0x00000000 ecx=0x00000000 edx=0x00000000
   0x0000000d 0x00: eax=0x00000007 ebx=0x00000240 ecx=0x00000340 edx=0x00000000
   0x0000000d 0x01: eax=0x00000001 ebx=0x00000000 ecx=0x00000000 edx=0x00000000
   0x0000000d 0x02: eax=0x00000100 ebx=0x00000240 ecx=0x00000000 edx=0x00000000
   0x0000000d 0x03: eax=0x00000000 ebx=0x00000000 ecx=0x00000000 edx=0x00000000
   0x0000000d 0x04: eax=0x00000000 ebx=0x00000000 ecx=0x00000000 edx=0x00000000
   0x0000000d 0x05: eax=0x00000000 ebx=0x00000000 ecx=0x00000000 edx=0x00000000
   0x0000000d 0x06: eax=0x00000000 ebx=0x00000000 ecx=0x00000000 edx=0x00000000
   0x0000000d 0x07: eax=0x00000000 ebx=0x00000000 ecx=0x00000000 edx=0x00000000
   0x80000000 0x00: eax=0x8000000a ebx=0x756e6547 ecx=0x6c65746e edx=0x49656e69
   0x80000001 0x00: eax=0x000306d2 ebx=0x00000000 ecx=0x00000101 edx=0x28100800
   0x80000002 0x00: eax=0x65746e49 ebx=0x6f43206c ecx=0x50206572 edx=0x65636f72
   0x80000003 0x00: eax=0x726f7373 ebx=0x72422820 ecx=0x7764616f edx=0x2c6c6c65
   0x80000004 0x00: eax=0x206f6e20 ebx=0x29585354 ecx=0x00000000 edx=0x00000000
   0x80000005 0x00: eax=0x01ff01ff ebx=0x01ff01ff ecx=0x40020140 edx=0x40020140
   0x80000006 0x00: eax=0x00000000 ebx=0x42004200 ecx=0x02008140 edx=0x00000000
   0x80000007 0x00: eax=0x00000000 ebx=0x00000000 ecx=0x00000000 edx=0x00000000
   0x80000008 0x00: eax=0x00003028 ebx=0x00000000 ecx=0x00000000 edx=0x00000000
   0x8000000a 0x00: eax=0x00000000 ebx=0x00000000 ecx=0x00000000 edx=0x00000000
   0xc0000000 0x00: eax=0x00000007 ebx=0x00000240 ecx=0x00000340 edx=0x00000000
   0x40000000 0x00: eax=0x40000001 ebx=0x4b4d564b ecx=0x564b4d56 edx=0x0000004d
   0x40000001 0x00: eax=0x0100007b ebx=0x00000000 ecx=0x00000000 edx=0x00000000
==END TEST==
